title,abstract,authors,keywords,year,language
Outcome of Alagille Syndrome Patients Who Had Previously Received Kasai Operation during Infancy: A Single Center Study | Outcome of Alagille Syndrome Patients Who Had Previously Received Kasai Operation during Infancy: A Single Center Study,"Purpose: Infants with Alagille syndrome (AGS) are occasionally misdiagnosed as biliary atresia and subsequently undergo Kasai operation. The purpose of this study was to investigate the outcome of patients with AGS who had previously received Kasai operation during infancy.Methods: This retrospective study was conducted at the Department of Pediatrics, Samsung Medical Center. We compared the prognosis and mortality between those who had undergone Kasai operation during infancy (Kasai group) and those who had not (non-Kasai group).Results: Among the 15 children with AGS, five had received Kasai operation, while 10 had not. All subjects in the Kasai group revealed neonatal cholestasis, while 70% of the non-Kasai group showed neonatal cholestasis. Liver transplantation was performed in 100% (5/5) among the Kasai group, and 20.0% (2/10) among the non-Kasai group (p=0.007). Mortality was observed in 60.0% (3/5) among the Kasai group, and 10.0% (1/10) among the non-Kasai group (p=0.077). Conclusion: Although overall mortality rate did not significantly differ between the two groups, the proportion of pa-tients receiving liver transplantation was significantly higher in the non-Kasai group. The relatively worse outcome in AGS patients who had received Kasai operation may be due to the unfavorable influences of Kasai operation on the clinical course of AGS, or maybe due to neonatal cholestasis, irrespective of the Kasai operation. Purpose: Infants with Alagille syndrome (AGS) are occasionally misdiagnosed as biliary atresia and subsequently undergo Kasai operation. The purpose of this study was to investigate the outcome of patients with AGS who had previously received Kasai operation during infancy.Methods: This retrospective study was conducted at the Department of Pediatrics, Samsung Medical Center. We compared the prognosis and mortality between those who had undergone Kasai operation during infancy (Kasai group) and those who had not (non-Kasai group).Results: Among the 15 children with AGS, five had received Kasai operation, while 10 had not. All subjects in the Kasai group revealed neonatal cholestasis, while 70% of the non-Kasai group showed neonatal cholestasis. Liver transplantation was performed in 100% (5/5) among the Kasai group, and 20.0% (2/10) among the non-Kasai group (p=0.007). Mortality was observed in 60.0% (3/5) among the Kasai group, and 10.0% (1/10) among the non-Kasai group (p=0.077). Conclusion: Although overall mortality rate did not significantly differ between the two groups, the proportion of pa-tients receiving liver transplantation was significantly higher in the non-Kasai group. The relatively worse outcome in AGS patients who had received Kasai operation may be due to the unfavorable influences of Kasai operation on the clinical course of AGS, or maybe due to neonatal cholestasis, irrespective of the Kasai operation.",이화평(성균관대학교); Ben Kang(성균관대학교); 최소윤(성균관대학교); 이상훈(성균관대학교); 이석구(성균관대학교); 최연호(성균관대학교),소아과학,2015-09,영어
Asymptomatic Bile Duct Dilatation in Children: Is It a Disease? | Asymptomatic Bile Duct Dilatation in Children: Is It a Disease?,"Purpose: Bile duct dilatation is a relatively common sonographic finding; nevertheless, its clinical significance in children is controversial because little research has been done in the area. Therefore, we investigated the natural course and clinical significance of biliary duct dilatation in children.Methods: We performed a retrospective study of 181 children (range, 1-day-old to 17-year-old) in whom dilatation of the intrahepatic duct and/or common hepatic duct and/or common bile duct was detected by abdominal ultra-sonography at the Severance Children's Hospital between November 2005 and March 2014. We reviewed and ana-lyzed laboratory test results, clinical manifestations, and clinical course in these patients.Results: Pediatric patients (n=181) were enrolled in the study and divided into two groups. The first group included 59 subjects, without definitive cause of bile duct dilatation, who did not require treatment; the second group included 122 subjects, with definitive cause of bile duct dilatation or underlying biliary disease, who did require treatment. In the first group, 24 patients (40.7%) showed spontaneous resolution of bile duct dilatation, 20 patients (33.9%) showed no change, and 15 patients (25.4%) were lost to follow-up. In the second group, 31 patients were diagnosed with choledochal cysts, and 91 patients presented with biliary tract dilatations due to secondary causes, such as gallbladder or liver disease, post-operative complications, or malignancy.Conclusion: Biliary dilatation in pediatric patients without symptoms, and without laboratory and other sonographic abnormalities, showed a benign clinical course. No pathologic conditions were noted on follow-up ultrasonography. Purpose: Bile duct dilatation is a relatively common sonographic finding; nevertheless, its clinical significance in children is controversial because little research has been done in the area. Therefore, we investigated the natural course and clinical significance of biliary duct dilatation in children.Methods: We performed a retrospective study of 181 children (range, 1-day-old to 17-year-old) in whom dilatation of the intrahepatic duct and/or common hepatic duct and/or common bile duct was detected by abdominal ultra-sonography at the Severance Children's Hospital between November 2005 and March 2014. We reviewed and ana-lyzed laboratory test results, clinical manifestations, and clinical course in these patients.Results: Pediatric patients (n=181) were enrolled in the study and divided into two groups. The first group included 59 subjects, without definitive cause of bile duct dilatation, who did not require treatment; the second group included 122 subjects, with definitive cause of bile duct dilatation or underlying biliary disease, who did require treatment. In the first group, 24 patients (40.7%) showed spontaneous resolution of bile duct dilatation, 20 patients (33.9%) showed no change, and 15 patients (25.4%) were lost to follow-up. In the second group, 31 patients were diagnosed with choledochal cysts, and 91 patients presented with biliary tract dilatations due to secondary causes, such as gallbladder or liver disease, post-operative complications, or malignancy.Conclusion: Biliary dilatation in pediatric patients without symptoms, and without laboratory and other sonographic abnormalities, showed a benign clinical course. No pathologic conditions were noted on follow-up ultrasonography.","Yeo Ju Son(Severance Children’s Hospital, Yonsei University); Mi Jung Lee(Yonsei University); Hong Koh(Severance Children’s Hospital, Yonsei University); 김승(연세의료원)",소아과학,2015-09,영어
Diagnostic Value of Ceruloplasmin in the Diagnosis of PediatricWilson’s Disease | Diagnostic Value of Ceruloplasmin in the Diagnosis of PediatricWilson’s Disease,"Purpose: Measurement of serum ceruloplasmin level is the first step in screening for Wilson's disease (WD). Despite the rarity of WD in the general population, ceruloplasmin levels are routinely measured through hepatitis screening in both adults and children. Herein, we evaluated the diagnostic value of ceruloplasmin for the diagnosis of WD among children with hepatitis.Methods: We retrospectively reviewed data on serum ceruloplasmin levels measured as a serologic marker for pa-tients with hepatitis at Asan Medical Center (Seoul, Korea) between from January 2004 to November 2013. The diagnosis of WD was confirmed by the identification of pathogenic variants in the ATP7B gene. To determine the diagnostic accuracy of ceruloplasmin, receiver operation characteristic (ROC) curves were constructed and the area under curve (AUC) were calculated. Results: Measurements of serum ceruloplasmin were performed in 2,834 children who had hepatitis. Among these, 181 (6.4%) children were diagnosed with WD. The sensitivity, specificity, and accuracy of a ceruloplasmin level of ＜20 mg/dL in the discrimination of WD were 93.4%, 84.2%, and 84.8%, respectively. In this study, 418 (14.7%) false-positive cases and 12 (0.4%) false-negative cases were noted. Using a ROC curve, a ceruloplasmin level of ≤16.6 mg/dL showed the highest AUC value (0.956) with a sensitivity of 91.2%, a specificity of 94.9%, and an accu-racy of 94.7%.Conclusion: The measurement of serum ceruloplasmin was frequently used for the screening of WD in children, despite a low positive rate. The diagnostic value of ceruloplasmin may be strengthened by adopting a new lower cut-off level. Purpose: Measurement of serum ceruloplasmin level is the first step in screening for Wilson's disease (WD). Despite the rarity of WD in the general population, ceruloplasmin levels are routinely measured through hepatitis screening in both adults and children. Herein, we evaluated the diagnostic value of ceruloplasmin for the diagnosis of WD among children with hepatitis.Methods: We retrospectively reviewed data on serum ceruloplasmin levels measured as a serologic marker for pa-tients with hepatitis at Asan Medical Center (Seoul, Korea) between from January 2004 to November 2013. The diagnosis of WD was confirmed by the identification of pathogenic variants in the ATP7B gene. To determine the diagnostic accuracy of ceruloplasmin, receiver operation characteristic (ROC) curves were constructed and the area under curve (AUC) were calculated. Results: Measurements of serum ceruloplasmin were performed in 2,834 children who had hepatitis. Among these, 181 (6.4%) children were diagnosed with WD. The sensitivity, specificity, and accuracy of a ceruloplasmin level of ＜20 mg/dL in the discrimination of WD were 93.4%, 84.2%, and 84.8%, respectively. In this study, 418 (14.7%) false-positive cases and 12 (0.4%) false-negative cases were noted. Using a ROC curve, a ceruloplasmin level of ≤16.6 mg/dL showed the highest AUC value (0.956) with a sensitivity of 91.2%, a specificity of 94.9%, and an accu-racy of 94.7%.Conclusion: The measurement of serum ceruloplasmin was frequently used for the screening of WD in children, despite a low positive rate. The diagnostic value of ceruloplasmin may be strengthened by adopting a new lower cut-off level.","Jung Ah Kim(Asan Medical Center Children’s Hospital); Hyun Jin Kim(Asan Medical Center Children’s Hospital); Jin Min Cho(Asan Medical Center Children’s Hospital); Seak Hee Oh(Asan Medical Center Children’s Hospital, University of Ulsan College of Medicine); Beom Hee Lee(Asan Medical Center Children’s Hospital); Gu-Hwan Kim(Asan Medical Center Children’s Hospital); Jin-Ho Choi(Asan Medical Center Children’s Hospital); Kyung Mo Kim(Asan Medical Center Children’s Hospital, University of Ulsan College of Medicine); Han-Wook Yoo(Asan Medical Center Children’s Hospital)",소아과학,2015-09,영어
Ileal Fecaloma Presenting with Small Bowel Obstruction | Ileal Fecaloma Presenting with Small Bowel Obstruction,"A fecaloma refers to a mass of accumulated feces that is much harder than a mass associated with fecal impaction. Fecalomas are usually found in the rectosigmoid area. A 10-year-old male with chronic constipation was admitted because of increasing abdominal pain. An abdominal computed tomography scan and a simple abdominal x-ray revealed rapidly evolving mechanical obstruction in the small intestine. Most of the fecalomas are successfully treated by conservative methods such as laxatives, enemas and rectal evacuation. When conservative treatments have failed, surgical intervention may be needed. In this case, an emergency operation was performed and a 4×3×2.5cm fecaloma was found in the distal ileum. We thus report a case of ileal fecaloma inducing small bowel obstruction in a patient with chronic constipation, who required surgical intervention. When symptoms of acute small intestinal obstruction develop in a patient with chronic constipation, a fecaloma should be considered in differential diagnosis. A fecaloma refers to a mass of accumulated feces that is much harder than a mass associated with fecal impaction. Fecalomas are usually found in the rectosigmoid area. A 10-year-old male with chronic constipation was admitted because of increasing abdominal pain. An abdominal computed tomography scan and a simple abdominal x-ray revealed rapidly evolving mechanical obstruction in the small intestine. Most of the fecalomas are successfully treated by conservative methods such as laxatives, enemas and rectal evacuation. When conservative treatments have failed, surgical intervention may be needed. In this case, an emergency operation was performed and a 4×3×2.5cm fecaloma was found in the distal ileum. We thus report a case of ileal fecaloma inducing small bowel obstruction in a patient with chronic constipation, who required surgical intervention. When symptoms of acute small intestinal obstruction develop in a patient with chronic constipation, a fecaloma should be considered in differential diagnosis.",Ha Yeong Yoo(Konkuk University Medical Center); Hye Won Park(Konkuk University Medical Center); Seong-Hwan Chang(Konkuk University Medical Center); Sun Hwan Bae(Konkuk University Medical Center),소아과학,2015-09,영어
Tubular Colonic Duplication Presenting as Rectovestibular Fistula | Tubular Colonic Duplication Presenting as Rectovestibular Fistula,Complete colonic duplication is a very rare congenital anomaly that may have different presentations according to its location and size. Complete colonic duplication can occur in about 15% of all gastrointestinal duplications. Double termination of tubular colonic duplication in the perineum is even more uncommon. We present a case of a Y-shaped tubular colonic duplication which presented with a rectovestibular fistula and a normal anus. Radiological evaluation and initial exploration for sigmoidostomy revealed duplicated colons with a common vascular supply. Endorectal mucosal resection of theduplicated distal segment till the colostomy site with division of the septum of the proximal segment and colostomy closure proved curative without compromise of the continence mechanism. Tubular colonic duplication should always be ruled out when a diagnosis of perineal canal is considered in cases of vestibular fistula alongwith a normal anus. Complete colonic duplication is a very rare congenital anomaly that may have different presentations according to its location and size. Complete colonic duplication can occur in about 15% of all gastrointestinal duplications. Double termination of tubular colonic duplication in the perineum is even more uncommon. We present a case of a Y-shaped tubular colonic duplication which presented with a rectovestibular fistula and a normal anus. Radiological evaluation and initial exploration for sigmoidostomy revealed duplicated colons with a common vascular supply. Endorectal mucosal resection of theduplicated distal segment till the colostomy site with division of the septum of the proximal segment and colostomy closure proved curative without compromise of the continence mechanism. Tubular colonic duplication should always be ruled out when a diagnosis of perineal canal is considered in cases of vestibular fistula alongwith a normal anus.,"Parag J. Karkera(Bai Jerbai Wadia Hospital for Children, Mumbai, India); Pradnya Bendre(Bai Jerbai Wadia Hospital for Children, Mumbai, India); Flavia D’souza(Bai Jerbai Wadia Hospital for Children, Mumbai, India); Mukunda Ramchandra(Bai Jerbai Wadia Hospital for Children, Mumbai, India); Amol Nage(Bai Jerbai Wadia Hospital for Children, Mumbai, India); Nitin Palse(Bai Jerbai Wadia Hospital for Children, Mumbai, India)",소아과학,2015-09,영어
Presentation of Progressive Familial Intrahepatic Cholestasis Type 3 Mimicking Wilson Disease: Molecular Genetic Diagnosis and Response to Treatment | Presentation of Progressive Familial Intrahepatic Cholestasis Type 3 Mimicking Wilson Disease: Molecular Genetic Diagnosis and Response to Treatment,"Progressive familial intrahepatic cholestasis type 3 (PFIC3) is an autosomal recessive disorder of cholestasis of hepatocellular origin, typically seen in infancy or childhood caused by a defect in the ABCB4 located on chromosome 7. Here we report on an older patient, aged 15, who presented with biochemical testing that led to an initial consid-eration of a diagnosis of Wilson disease (WD) resulting in a delayed diagnosis of PFIC3. Diagnosis of PFIC3 was later confirmed by molecular studies that identified novel mutations in the ABCB4 gene. Cholestasis due to PFIC3 can cause elevated hepatic copper and increased urine copper excretion that overlap with current diagnostic criteria for WD. Molecular diagnostics are very useful for establishing the diagnosis of PFIC3. Ursodeoxycholic acid amelio-rates cholestasis in PFIC3, and may help mediate a reduction in hepatic copper content in response to treatment. Progressive familial intrahepatic cholestasis type 3 (PFIC3) is an autosomal recessive disorder of cholestasis of hepatocellular origin, typically seen in infancy or childhood caused by a defect in the ABCB4 located on chromosome 7. Here we report on an older patient, aged 15, who presented with biochemical testing that led to an initial consid-eration of a diagnosis of Wilson disease (WD) resulting in a delayed diagnosis of PFIC3. Diagnosis of PFIC3 was later confirmed by molecular studies that identified novel mutations in the ABCB4 gene. Cholestasis due to PFIC3 can cause elevated hepatic copper and increased urine copper excretion that overlap with current diagnostic criteria for WD. Molecular diagnostics are very useful for establishing the diagnosis of PFIC3. Ursodeoxycholic acid amelio-rates cholestasis in PFIC3, and may help mediate a reduction in hepatic copper content in response to treatment.","Salih Boga(Yale University School of Medicine, New Haven, CT, USA); Dhanpat Jain(Yale University School of Medicine, New Haven, CT, USA); Michael L. Schilsky(Yale University School of Medicine, New Haven, CT, USA)",소아과학,2015-09,영어
Acute Necrotizing Pancreatitis Associated with Mycoplasma pneumoniae Infection in a Child | Acute Necrotizing Pancreatitis Associated with Mycoplasma pneumoniae Infection in a Child,"Mycoplasma pneumoniae is responsible for approximately 20% to 30% of community-acquired pneumonia, and is well known for its diverse extrapulmonary manifestations. However, acute necrotizing pancreatits is an extremely rare extrapulmonary manifestation of M. pneumoniae infection. A 6-year-old girl was admitted due to abdominal pain, vomiting, fever, and confused mentality. Acute necrotizing pancreatitis was diagnosed according to symptoms, laboratory test results, and abdominal computed tomography scans. M. pneumoniae infection was diagnosed by a 4-fold increase in antibodies to M. pneumoniae between acute and convalescent sera by particle agglutination antibody assay. No other etiologic factors or pathogens were detected. Despite the occurrence of a large infected pseudocyst during the course, the patient was able to discharge without morbidity by early aggressive supportive care. This is the first case in Korea of a child with acute necrotizing pancreatitis associated with M. pneumoniaeinfection. Mycoplasma pneumoniae is responsible for approximately 20% to 30% of community-acquired pneumonia, and is well known for its diverse extrapulmonary manifestations. However, acute necrotizing pancreatits is an extremely rare extrapulmonary manifestation of M. pneumoniae infection. A 6-year-old girl was admitted due to abdominal pain, vomiting, fever, and confused mentality. Acute necrotizing pancreatitis was diagnosed according to symptoms, laboratory test results, and abdominal computed tomography scans. M. pneumoniae infection was diagnosed by a 4-fold increase in antibodies to M. pneumoniae between acute and convalescent sera by particle agglutination antibody assay. No other etiologic factors or pathogens were detected. Despite the occurrence of a large infected pseudocyst during the course, the patient was able to discharge without morbidity by early aggressive supportive care. This is the first case in Korea of a child with acute necrotizing pancreatitis associated with M. pneumoniaeinfection.",양아람(성균관대학교); Ben Kang(성균관대학교); 최소윤(성균관대학교); 조중범(성균관대학교); 김예진(성균관대학교); 전태연(성균관대학교); 최연호(성균관대학교),소아과학,2015-09,영어
Characteristics of Pediatric Pancreatitis on Magnetic Resonance Cholangiopancreatography | Characteristics of Pediatric Pancreatitis on Magnetic Resonance Cholangiopancreatography,"Pediatric pancreatitis is not uncommon and results in considerable morbidity and mortality in the affected children. Unlike adults, pediatric pancreatitis is more frequently associated with underlying structural abnormalities, trauma, and drugs rather than an idiopathic etiology. Magnetic resonance cholangiopancreatography (MRCP) is a good imaging modality for evaluating pancreatitis and determining etiology without exposure to radiation. This article focuses on MRCP findings associated with various causes of pancreatitis in children, particularly structural abnormalities of the pancreaticobiliary system, as well as describing the feasibility, limitations, and solutions associated with pediatric MRCP. Pediatric pancreatitis is not uncommon and results in considerable morbidity and mortality in the affected children. Unlike adults, pediatric pancreatitis is more frequently associated with underlying structural abnormalities, trauma, and drugs rather than an idiopathic etiology. Magnetic resonance cholangiopancreatography (MRCP) is a good imaging modality for evaluating pancreatitis and determining etiology without exposure to radiation. This article focuses on MRCP findings associated with various causes of pancreatitis in children, particularly structural abnormalities of the pancreaticobiliary system, as well as describing the feasibility, limitations, and solutions associated with pediatric MRCP.",황재연(아산병원); 윤혜경(강원대학교병원); 김경모(아산병원),소아과학,2015-09,영어
Pediatric Magnetic Resonance Enterography: Focused on Crohn’s Disease | Pediatric Magnetic Resonance Enterography: Focused on Crohn’s Disease,"Crohn’s disease is a chronic idiopathic inflammatory disease of the intestines characterized by frequent relapse and remission. It often develops in children and adolescents, who are vulnerable to repeated exposure to ionizing radiations. Magnetic resonance enterography (MRE) is an increasingly important radiation-free imaging modality that is used to evaluate pediatric patients with Crohn’s disease. MRE can evaluate extraluminal and extraintestinal abnormalities as well as the status of the bowel wall. In addition, MRE has an advantage in the evaluation of the small bowel involvement. MRE can be used for the initial diagnosis of Crohn’s disease, and can aid in the assessment of disease activity and complications such as penetrating and fibrostenotic diseases. The aims of this article are to review the MRE technique for obtaining diagnostic and high-quality images and to discuss interpretations of imag-ing findings in patients with Crohn’s disease. Crohn’s disease is a chronic idiopathic inflammatory disease of the intestines characterized by frequent relapse and remission. It often develops in children and adolescents, who are vulnerable to repeated exposure to ionizing radiations. Magnetic resonance enterography (MRE) is an increasingly important radiation-free imaging modality that is used to evaluate pediatric patients with Crohn’s disease. MRE can evaluate extraluminal and extraintestinal abnormalities as well as the status of the bowel wall. In addition, MRE has an advantage in the evaluation of the small bowel involvement. MRE can be used for the initial diagnosis of Crohn’s disease, and can aid in the assessment of disease activity and complications such as penetrating and fibrostenotic diseases. The aims of this article are to review the MRE technique for obtaining diagnostic and high-quality images and to discuss interpretations of imag-ing findings in patients with Crohn’s disease.",So Mi Lee(KyungpookNational University); 김우선(서울대학교); Young Hun Choi(Seoul National University),소아과학,2015-09,영어
