title,abstract,authors,keywords,year,language
The Efficacy of Saccharomyces boulardii CNCM I-745 in Addition to Standard Helicobacter pylori Eradication Treatment in Children | The Efficacy of Saccharomyces boulardii CNCM I-745 in Addition to Standard Helicobacter pylori Eradication Treatment in Children,"Purpose: This study aims to investigate Saccharomyces boulardii CNCM I-745 during Helicobacter pylori eradication in children. Methods: One hundred ninety-four H. pylori positive children were randomized in two groups. Therapy (omepra-zole+clarithromycin+amoxicillin or omeprazole+clarithromycin+metronidazole in case of penicillin allergy) was given to both groups during two weeks. In the treatment group (n: 102) S. boulardii was added to the triple therapy, while the control group (n: 92) only received triple therapy. The incidence, onset, duration and severity of diarrhea and com-pliance to the eradication treatment were compared. A 13C urea breath test was done 4 weeks after the end of eradication therapy in two groups of 21 patients aged 12 years and older to test the H. pylori eradication rate. Results: In the treatment group, diarrhea occurred in 12 cases (11.76%), starting after 6.25±1.24 days, lasting 3.17±1.08 days, and compliance to eradication treatment was 100%. In the control group, diarrhea occurred in 26 cases (28.26%), starting after 4.05±1.11 days, lasting 4.02±0.87 days, and in six cases eradication treatment was stopped prematurely (p＜0.05). The 13C urea breath test showed successful H. pylori eradication in 71.4% of the patients in the treatment and in 61.9 % in the control group (not significant). Conclusion: S. boulardii has a beneficial effect on the prevention and treatment of diarrhea during H. pylori eradication in children. Although S. boulardii did only slightly increase H. pylori eradication rate, compliance to eradication treat-ment was improved. Purpose: This study aims to investigate Saccharomyces boulardii CNCM I-745 during Helicobacter pylori eradication in children. Methods: One hundred ninety-four H. pylori positive children were randomized in two groups. Therapy (omepra-zole+clarithromycin+amoxicillin or omeprazole+clarithromycin+metronidazole in case of penicillin allergy) was given to both groups during two weeks. In the treatment group (n: 102) S. boulardii was added to the triple therapy, while the control group (n: 92) only received triple therapy. The incidence, onset, duration and severity of diarrhea and com-pliance to the eradication treatment were compared. A 13C urea breath test was done 4 weeks after the end of eradication therapy in two groups of 21 patients aged 12 years and older to test the H. pylori eradication rate. Results: In the treatment group, diarrhea occurred in 12 cases (11.76%), starting after 6.25±1.24 days, lasting 3.17±1.08 days, and compliance to eradication treatment was 100%. In the control group, diarrhea occurred in 26 cases (28.26%), starting after 4.05±1.11 days, lasting 4.02±0.87 days, and in six cases eradication treatment was stopped prematurely (p＜0.05). The 13C urea breath test showed successful H. pylori eradication in 71.4% of the patients in the treatment and in 61.9 % in the control group (not significant). Conclusion: S. boulardii has a beneficial effect on the prevention and treatment of diarrhea during H. pylori eradication in children. Although S. boulardii did only slightly increase H. pylori eradication rate, compliance to eradication treat-ment was improved.","Zhang Bin(Shanghai Children’s Medical Center, Shanghai, China); Xu Ya-Zheng(Shanghai Children’s Medical Center, Shanghai, China); Deng Zhao-Hui(Shanghai Children’s Medical Center, Shanghai, China); Chu Bo(Shanghai Children’s Medical Center, Shanghai, China); Jiang Li-Rong(Shanghai Children’s Medical Center, Shanghai, China); Yvan Vandenplas(Vrije Universiteit Brussel, Brussels, Belgium)",소아과학,2015-03,영어
Clinical Characteristics of Celiac Disease and Dietary Adherence to Gluten-Free Diet among Saudi Children | Clinical Characteristics of Celiac Disease and Dietary Adherence to Gluten-Free Diet among Saudi Children,"Purpose: To describe the clinical characteristics of celiac disease (CD) among Saudi children and to determine the adherence rate to gluten free diet (GFD) and its determinant factors among them.Methods: A cross-sectional study was conducted, in which all the families registered in the Saudi Celiac Patients Support Group were sent an online survey. Only families with children 18 years of age and younger with biopsy-con-firmed CD were included.Results: The median age of the 113 included children was 9.9 years, the median age at symptom onset was 5.5 years and the median age at diagnosis was 7 years, the median time between the presentation and the final diagnosis was 1 year. Sixty two of the involved children were females. Ninety two percent of the patients were symptomatic at the diagnosis while eight percent were asymptomatic. The commonest presenting symptoms included: chronic abdominal pain (59.3%), poor weight gain (54%), abdominal distention, gases, bloating (46.1%) and chronic diarrhea (41.6%). Sixty percent of the involved children were reported to be strictly adherent to GFD. Younger age at diagnosis and shorter duration since the diagnosis were associated with a better adherence rate. Conclusion: CD has similar clinical presentations among Saudi children compared to other parts of the ward; however, the adherence to GFD is relatively poor. Younger age at diagnosis and shorter duration since the diagnosis were associated with a better adherence rate. Purpose: To describe the clinical characteristics of celiac disease (CD) among Saudi children and to determine the adherence rate to gluten free diet (GFD) and its determinant factors among them.Methods: A cross-sectional study was conducted, in which all the families registered in the Saudi Celiac Patients Support Group were sent an online survey. Only families with children 18 years of age and younger with biopsy-con-firmed CD were included.Results: The median age of the 113 included children was 9.9 years, the median age at symptom onset was 5.5 years and the median age at diagnosis was 7 years, the median time between the presentation and the final diagnosis was 1 year. Sixty two of the involved children were females. Ninety two percent of the patients were symptomatic at the diagnosis while eight percent were asymptomatic. The commonest presenting symptoms included: chronic abdominal pain (59.3%), poor weight gain (54%), abdominal distention, gases, bloating (46.1%) and chronic diarrhea (41.6%). Sixty percent of the involved children were reported to be strictly adherent to GFD. Younger age at diagnosis and shorter duration since the diagnosis were associated with a better adherence rate. Conclusion: CD has similar clinical presentations among Saudi children compared to other parts of the ward; however, the adherence to GFD is relatively poor. Younger age at diagnosis and shorter duration since the diagnosis were associated with a better adherence rate.","Ahmed Al Sarkhy(King Khalid University Hospital, Riyadh, Saudi Arabia); Mohammad I. El Mouzan(King Khalid University Hospital, Riyadh, Saudi Arabia); Elshazaly Saeed(King Saud University, Riyadh, Saudi Arabia); Aziz Alanazi(National Guard Health Affairs, Riyadh, Saudi Arabia); Sharifa Alghamdi(King Faisal Specialist Hospital and Research Center, Jeddah, Saudi Arabia); Shirin Anil and Asaad Assiri(King Saud University, Riyadh, Saudi Arabia)",소아과학,2015-03,영어
Availability of Blood Urea Nitrogen/Creatinine Ratio in Gastrointestinal Bleeding with Melena in Children | Availability of Blood Urea Nitrogen/Creatinine Ratio in Gastrointestinal Bleeding with Melena in Children,"Purpose: The aims of our study were to evaluate the blood urea nitrogen to creatinine ratio (BUN/Cr ratio) for dis-tinguishing between an upper and lower gastrointestinal bleeding (GIB), and differentiating between the two most common causes of upper gastrointestinal bleeding (UGIB) presenting with melena in children.Methods: Retrospective data of patients with GIB presenting with melena were analyzed. The data from 60 cases were reviewed including demographics, laboratory findings, diagnostic modalities and results, treatments, and transfusions.Results: Among the 60 cases, UGIB and lower gastrointestinal bleeding (LGIB) were found in 35 cases (58.3%) and 14 cases (23.3%), respectively. The two common causes of UGIB were varices (37.1%), and peptic ulcer dis-eases (PUD) (31.4%). The BUN/Cr ratio of 30 or greater was higher in UGIB than LGIB (odds ratio [OR], 6.9; 95% confidence interval [95% CI], 1.3-37.2). In UGIB, the BUN/Cr ratio of the varices group was higher than that of the PUD group (p=0.015). The OR for the BUN/Cr ratio appeared as 1.2 per unit increase in the varices group than the PUD group (95% CI, 1.03-1.3). There was no difference between the PUD group and Meckel’s diverticulum group.Conclusion: The BUN/Cr ratio was not uneven in differentiating UGIB from LGIB of children with melena in our study. This suggests that BUN/Cr ratio should be interpreted carefully. Purpose: The aims of our study were to evaluate the blood urea nitrogen to creatinine ratio (BUN/Cr ratio) for dis-tinguishing between an upper and lower gastrointestinal bleeding (GIB), and differentiating between the two most common causes of upper gastrointestinal bleeding (UGIB) presenting with melena in children.Methods: Retrospective data of patients with GIB presenting with melena were analyzed. The data from 60 cases were reviewed including demographics, laboratory findings, diagnostic modalities and results, treatments, and transfusions.Results: Among the 60 cases, UGIB and lower gastrointestinal bleeding (LGIB) were found in 35 cases (58.3%) and 14 cases (23.3%), respectively. The two common causes of UGIB were varices (37.1%), and peptic ulcer dis-eases (PUD) (31.4%). The BUN/Cr ratio of 30 or greater was higher in UGIB than LGIB (odds ratio [OR], 6.9; 95% confidence interval [95% CI], 1.3-37.2). In UGIB, the BUN/Cr ratio of the varices group was higher than that of the PUD group (p=0.015). The OR for the BUN/Cr ratio appeared as 1.2 per unit increase in the varices group than the PUD group (95% CI, 1.03-1.3). There was no difference between the PUD group and Meckel’s diverticulum group.Conclusion: The BUN/Cr ratio was not uneven in differentiating UGIB from LGIB of children with melena in our study. This suggests that BUN/Cr ratio should be interpreted carefully.",Kyu Seon Kim(Chungnam National University); Chan Ho Kang(Chungnam National University); Jae Young Kim(Chungnam National University School of Medicine),소아과학,2015-03,영어
Liver Transplantation for Metabolic Liver Disease: Experience at a Living Donor Dominant Liver Transplantation Center | Liver Transplantation for Metabolic Liver Disease: Experience at a Living Donor Dominant Liver Transplantation Center,"Purpose: Metabolic liver disease (MLD) often progresses to life-threatening conditions. This study intends to describe the outcomes of liver transplantation (LTx) for MLD at a living donor-dominant transplantation center where potentially heterozygous carrier grafts are employed. Methods: We retrospectively evaluated the medical records of 54 patients with MLD who underwent LTx between November 1995 and February 2012 at Asan Medical Center in Seoul, Korea. The cumulative graft and patient survival rates were analyzed according to patient age, and living or deceased donor LTx. Recurrence of the original disease was also investigated.Results: The post-transplant cumulative patient survival rates at one, five, and 10 years were 90.7%, 87.5% and 87.5%, and the graft survival rates were 88.8%, 85.5%, and 85.5%, respectively. There were no differences in the patient survival rates according to the recipient age, human leukocyte antigen matching, and living or deceased donor LTx. There were also no differences in the patient survival rates between the MLD and the non-MLD groups for children. Recurrence of the original metabolic disease was not observed in any patient during the follow-up period.Conclusion: Our results suggest that the living donor-dominant transplantation program is well-tolerated in MLD with-out recurrence of the original MLD using all types of transplantation. Purpose: Metabolic liver disease (MLD) often progresses to life-threatening conditions. This study intends to describe the outcomes of liver transplantation (LTx) for MLD at a living donor-dominant transplantation center where potentially heterozygous carrier grafts are employed. Methods: We retrospectively evaluated the medical records of 54 patients with MLD who underwent LTx between November 1995 and February 2012 at Asan Medical Center in Seoul, Korea. The cumulative graft and patient survival rates were analyzed according to patient age, and living or deceased donor LTx. Recurrence of the original disease was also investigated.Results: The post-transplant cumulative patient survival rates at one, five, and 10 years were 90.7%, 87.5% and 87.5%, and the graft survival rates were 88.8%, 85.5%, and 85.5%, respectively. There were no differences in the patient survival rates according to the recipient age, human leukocyte antigen matching, and living or deceased donor LTx. There were also no differences in the patient survival rates between the MLD and the non-MLD groups for children. Recurrence of the original metabolic disease was not observed in any patient during the follow-up period.Conclusion: Our results suggest that the living donor-dominant transplantation program is well-tolerated in MLD with-out recurrence of the original MLD using all types of transplantation.",김준석(서울아산병원); 김경모(울산대학교); 오석희(울산대학교 의학과); 김현진(울산대학교); 조진민(울산대학교 의학과); 유한욱(울산대학교); 남궁정만(울산대학교); 김대연(아산어린이병원); 김기훈(울산대학교); 황신(울산대학교); 이승규(울산대학교),소아과학,2015-03,영어
Achalasia Previously Diagnosed as Gastroesophageal Reflux Disease by Relying on Esophageal Impedance-pH Monitoring: Use of High-Resolution Esophageal Manometry in Children | Achalasia Previously Diagnosed as Gastroesophageal Reflux Disease by Relying on Esophageal Impedance-pH Monitoring: Use of High-Resolution Esophageal Manometry in Children,"Gastroesophageal reflux disorder (GERD) is the most common esophageal disorder in children. Achalasia occurs less commonly but has similar symptoms to GERD. A nine-year old boy presented with vomiting, heartburn, and nocturnal cough. The esophageal impedance-pH monitor revealed nonacidic GERD (all-refluxate clearance percent time of 20.9%). His symptoms persisted despite medical treatment for GERD, and he was lost to follow up. Four years later, he presented with heartburn, solid-food dysphagia, daily post-prandial vomiting, and failure to thrive. Endoscopy showed a severely dilated esophagus with candidiasis. High-resolution manometry was performed, and he was diagnosed with classic achalasia (also known as type I). His symptoms resolved after two pneumatic dilatation procedures, and his weight and height began to catch up to his peers. Clinicians might consider using high-resolution manometry in children with atypical GERD even after evaluation with an impedance-pH monitor. Gastroesophageal reflux disorder (GERD) is the most common esophageal disorder in children. Achalasia occurs less commonly but has similar symptoms to GERD. A nine-year old boy presented with vomiting, heartburn, and nocturnal cough. The esophageal impedance-pH monitor revealed nonacidic GERD (all-refluxate clearance percent time of 20.9%). His symptoms persisted despite medical treatment for GERD, and he was lost to follow up. Four years later, he presented with heartburn, solid-food dysphagia, daily post-prandial vomiting, and failure to thrive. Endoscopy showed a severely dilated esophagus with candidiasis. High-resolution manometry was performed, and he was diagnosed with classic achalasia (also known as type I). His symptoms resolved after two pneumatic dilatation procedures, and his weight and height began to catch up to his peers. Clinicians might consider using high-resolution manometry in children with atypical GERD even after evaluation with an impedance-pH monitor.",Jung Eun Pyun(Korea University); Da Min Choi(Korea University); 이정화(고려대학교); Kee Hwan Yoo(Korea University Medical Center); 심정옥(고려대학교),소아과학,2015-03,영어
Nutritional State of Children in the Democratic People’s Republic of Korea (DPRK): Based on the DPRK Final Report ofthe National Nutrition Survey 2012 | Nutritional State of Children in the Democratic People’s Republic of Korea (DPRK): Based on the DPRK Final Report ofthe National Nutrition Survey 2012,"A nationwide nutrition survey began when the Democratic People’s Republic of Korea (DPRK) requested assistance from international relief organizations in 1997 due to flooding in 1995-1996, followed by the worsening food shortage peak in 1997. According to reported data for the 15 years since the active intervention and assistance from interna-tional societies, the malnutrition and mortality rates of children in the DPRK have improved. However, the prevalence of the stunting reported in the latest 2012 report is 27.9%, which is still a moderate−severe level, and worrisome in terms of international standards. In particular, the prevalence in Ryangangdo, which is regarded as the worst region in the DPRK, is 39.6%, which is a very high level of stunting. To alleviate such regional deviation will be a major task for future assistance. In addition, one cannot emphasize too highly the importance of early nutritional assistance for pregnant women and infants, considering that the recovery from stunted growth is low after two years of age, and the aftereffects would continue for the rest of their lives. A nationwide nutrition survey began when the Democratic People’s Republic of Korea (DPRK) requested assistance from international relief organizations in 1997 due to flooding in 1995-1996, followed by the worsening food shortage peak in 1997. According to reported data for the 15 years since the active intervention and assistance from interna-tional societies, the malnutrition and mortality rates of children in the DPRK have improved. However, the prevalence of the stunting reported in the latest 2012 report is 27.9%, which is still a moderate−severe level, and worrisome in terms of international standards. In particular, the prevalence in Ryangangdo, which is regarded as the worst region in the DPRK, is 39.6%, which is a very high level of stunting. To alleviate such regional deviation will be a major task for future assistance. In addition, one cannot emphasize too highly the importance of early nutritional assistance for pregnant women and infants, considering that the recovery from stunted growth is low after two years of age, and the aftereffects would continue for the rest of their lives.",김정은(신천연합병원),소아과학,2014-09,영어
"High Incidence of Staphylococcus aureus and Norovirus Gastroenteritis in Infancy: A Single-Center, 1-Year Experience | High Incidence of Staphylococcus aureus and Norovirus Gastroenteritis in Infancy: A Single-Center, 1-Year Experience","Purpose: The etiology of acute gastroenteritis (AGE) has changed since the introduction of the rotavirus vaccination.
The aim of this study was to clarify which common pathogens, both bacterial and viral, are currently causing AGE in infants.
Methods: Infants with acute diarrhea were enrolled. We tested for 10 bacterial pathogens and five viral pathogens in stool specimens collected from infants with AGE. The clinical symptoms such as vomiting, mucoid or bloody diarrhea, dehydration, irritability, and poor oral intake were recorded, and laboratory data such as white blood cell count and C-reactive protein were collected. The clinical and laboratory data for the cases with bacterial pathogens and the cases with viral pathogens were compared.
Results: Of 41 total infants, 21 (51.2%) were positive for at least one pathogen. Seventeen cases (41.5%) were positive for bacterial pathogens and seven cases (17.1%) were positive for viral pathogens. Staphylococcus aureus (13 cases, 31.7%) and Clostridium perfringens (four cases, 9.8%) were common bacterial pathogens. Norovirus (five cases, 12.2%) was the most common viral pathogen. Fever and respiratory symptoms were common in the isolated viral infection group (p=0.023 and 0.044, respectively), whereas other clinical and laboratory data were indistinguishable between the groups.
Conclusion: In our study, S. aureus (41.5%) and norovirus (12.2%) were the most common bacterial and viral pathogens, respectively, among infants with AGE. Purpose: The etiology of acute gastroenteritis (AGE) has changed since the introduction of the rotavirus vaccination.
The aim of this study was to clarify which common pathogens, both bacterial and viral, are currently causing AGE in infants.
Methods: Infants with acute diarrhea were enrolled. We tested for 10 bacterial pathogens and five viral pathogens in stool specimens collected from infants with AGE. The clinical symptoms such as vomiting, mucoid or bloody diarrhea, dehydration, irritability, and poor oral intake were recorded, and laboratory data such as white blood cell count and C-reactive protein were collected. The clinical and laboratory data for the cases with bacterial pathogens and the cases with viral pathogens were compared.
Results: Of 41 total infants, 21 (51.2%) were positive for at least one pathogen. Seventeen cases (41.5%) were positive for bacterial pathogens and seven cases (17.1%) were positive for viral pathogens. Staphylococcus aureus (13 cases, 31.7%) and Clostridium perfringens (four cases, 9.8%) were common bacterial pathogens. Norovirus (five cases, 12.2%) was the most common viral pathogen. Fever and respiratory symptoms were common in the isolated viral infection group (p=0.023 and 0.044, respectively), whereas other clinical and laboratory data were indistinguishable between the groups.
Conclusion: In our study, S. aureus (41.5%) and norovirus (12.2%) were the most common bacterial and viral pathogens, respectively, among infants with AGE.",성경(부산대학교); 김지용(부산대학교); 이연주(부산대학교); 황은하(부산대학교 의학전문대학원 소아청소년과학교실); 박재홍(부산대학교),소아과학,2014-09,영어
