title,abstract,authors,keywords,year,language
A Case of Epiploic Appendagitis with Acute Gastroenteritis | A Case of Epiploic Appendagitis with Acute Gastroenteritis,"Epiploic appendagitis is an inflammation of the epiploic appendage in which the small sacs projecting from the serosal layer of the colon are positioned longitudinally from the caecum to the rectosigmoid area. Epiploic appendagitis is rare and self-limiting; however, it can cause sudden abdominal pain in children. Epiploic appendagitis does not typi-cally accompany other gastrointestinal diseases. Here, we report on a healthy eight-year-old girl who presented with abdominal pain, fever, vomiting, and diarrhea. Based on these symptoms, she was diagnosed with acute gastro-enteritis, but epiploic appendagitis in the ascending colon was revealed in contrast computed tomography (CT). The patient was treated successfully with conservative management. CT is beneficial in diagnosis and further assess-ment of epiploic appendagitis. Pediatricians need to be aware of this self-limiting disease and consider it as a possible alternate diagnosis in cases of acute abdominal pain. Epiploic appendagitis is an inflammation of the epiploic appendage in which the small sacs projecting from the serosal layer of the colon are positioned longitudinally from the caecum to the rectosigmoid area. Epiploic appendagitis is rare and self-limiting; however, it can cause sudden abdominal pain in children. Epiploic appendagitis does not typi-cally accompany other gastrointestinal diseases. Here, we report on a healthy eight-year-old girl who presented with abdominal pain, fever, vomiting, and diarrhea. Based on these symptoms, she was diagnosed with acute gastro-enteritis, but epiploic appendagitis in the ascending colon was revealed in contrast computed tomography (CT). The patient was treated successfully with conservative management. CT is beneficial in diagnosis and further assess-ment of epiploic appendagitis. Pediatricians need to be aware of this self-limiting disease and consider it as a possible alternate diagnosis in cases of acute abdominal pain.",조민선(가톨릭대학교); 황보석(가톨릭대학교); 최의윤(가톨릭대학교); 김환수(가톨릭대학교); 한승훈(가톨릭대학교),소아과학,2014-12,영어
Coexistence of Gilbert Syndrome and Hereditary Spherocytosis in a Child Presenting with Extreme Jaundice | Coexistence of Gilbert Syndrome and Hereditary Spherocytosis in a Child Presenting with Extreme Jaundice,"Gilbert syndrome is the most common inherited disorder of bilirubin glucuronidation. It is characterized by intermittent episodes of jaundice in the absence of hepatocellular disease or hemolysis. Hereditary spherocytosis is the most common inherited hemolytic anemia and is characterized by spherical, osmotically fragile erythrocytes that are se-lectively trapped by the spleen. The patients have variable degrees of anemia, jaundice, and splenomegaly. Hereditary spherocytosis usually leads to mild-to-moderate elevation of serum bilirubin levels. Severe hyper-bilirubinemia compared with the degree of hemolysis should be lead to suspicion of additional clinical conditions such as Gilbert syndrome or thalassemia. We present the case of a 12-year-old boy with extreme jaundice and nausea. The diagnosis of hereditary spherocytosis was confirmed by osmotic fragility test results and that of Gilbert syndrome by genetic analysis findings. Gilbert syndrome is the most common inherited disorder of bilirubin glucuronidation. It is characterized by intermittent episodes of jaundice in the absence of hepatocellular disease or hemolysis. Hereditary spherocytosis is the most common inherited hemolytic anemia and is characterized by spherical, osmotically fragile erythrocytes that are se-lectively trapped by the spleen. The patients have variable degrees of anemia, jaundice, and splenomegaly. Hereditary spherocytosis usually leads to mild-to-moderate elevation of serum bilirubin levels. Severe hyper-bilirubinemia compared with the degree of hemolysis should be lead to suspicion of additional clinical conditions such as Gilbert syndrome or thalassemia. We present the case of a 12-year-old boy with extreme jaundice and nausea. The diagnosis of hereditary spherocytosis was confirmed by osmotic fragility test results and that of Gilbert syndrome by genetic analysis findings.",이재희(조선대학교); 문경래(조선대학교),소아과학,2014-12,영어
Middle East Consensus Statement on the Diagnosis and Management of Functional Gastrointestinal Disorders in <12 Months Old Infants | Middle East Consensus Statement on the Diagnosis and Management of Functional Gastrointestinal Disorders in <12 Months Old Infants,"This paper covers algorithms for the management of regurgitation, constipation and infantile colic in infants. Anti-re-gurgitation formula may be considered in infants with troublesome regurgitation, while diagnostic investigations or drug therapy are not indicated in the absence of warning signs. Although probiotics have shown some positive evi-dence for the management of functional gastrointestinal disorders (FGIDs), the evidence is not strong enough to make a recommendation. A partially hydrolyzed infant formula with prebiotics and β-palmitate may be considered as a dietary intervention for functional constipation in formula fed infants. Lactulose has been shown to be effective and safe in infants younger than 6 months that are constipated. Macrogol (polyethylene glycol, PEG) is not approved for use in infants less than 6 months of age. However, PEG is preferred over lactulose in infants ＞6 months of age. Limited data suggests that infant formula with a partial hydrolysate, galacto-oligosaccharides/fructo-oligosac-charides, added β-palmitate may be of benefit in reducing infantile colic in formula fed infants in cases where cow’smilk protein allergy (CMPA) is not suspected. Evidence suggests that the use of extensively hydrolyzed infant formula for a formula-fed baby and a cow’s milk free diet for a breastfeeding mother may be beneficial to decrease infantile colic if CMPA is suspected. None of the FGIDs is a reason to stop breastfeeding. This paper covers algorithms for the management of regurgitation, constipation and infantile colic in infants. Anti-re-gurgitation formula may be considered in infants with troublesome regurgitation, while diagnostic investigations or drug therapy are not indicated in the absence of warning signs. Although probiotics have shown some positive evi-dence for the management of functional gastrointestinal disorders (FGIDs), the evidence is not strong enough to make a recommendation. A partially hydrolyzed infant formula with prebiotics and β-palmitate may be considered as a dietary intervention for functional constipation in formula fed infants. Lactulose has been shown to be effective and safe in infants younger than 6 months that are constipated. Macrogol (polyethylene glycol, PEG) is not approved for use in infants less than 6 months of age. However, PEG is preferred over lactulose in infants ＞6 months of age. Limited data suggests that infant formula with a partial hydrolysate, galacto-oligosaccharides/fructo-oligosac-charides, added β-palmitate may be of benefit in reducing infantile colic in formula fed infants in cases where cow’smilk protein allergy (CMPA) is not suspected. Evidence suggests that the use of extensively hydrolyzed infant formula for a formula-fed baby and a cow’s milk free diet for a breastfeeding mother may be beneficial to decrease infantile colic if CMPA is suspected. None of the FGIDs is a reason to stop breastfeeding.",Yvan Vandenplas(Universitair Ziekenhuis Brussel); Muath Abdurrahman Alturaiki(King Salman Hospital); Wafaa Al-Qabandi(Kuwait University); Fawaz AlRefaee(Al Adan Hospital); Ziad Bassil(St. Joseph Hospital); Bassam Eid(Hotel Dieu deFrance); Ahmed El Beleidy(Cairo University); Ali Ibrahim Almehaidib(King Faisal Specialist Hospital); Pierre Mouawad(St. Georges Orthodox); Maroun Sokhn(St. Georges Orthodox),소아과학,2016-09,영어
Socioeconomic Impacts of Gluten-Free Diet among Saudi Children with Celiac Disease | Socioeconomic Impacts of Gluten-Free Diet among Saudi Children with Celiac Disease,"Purpose: To determine the socio-economic impact of gluten free diet (GFD) on Saudi children and their families Methods: A cross-sectional study was conducted in which an online questionnaire was sent to all families registered in the Saudi celiac patients support group. We included only children (age 18 years of age and younger) with biop-sy-confirmed celiac disease (CD).Results: A total of 113 children were included in the final analysis, the median age was 9.9 years; 62.8% were females. One hundred (88.5%) of the participating families reported that GFD food was not easily available in their areas, 17% of them reported that it was not available at all in their area. One hundred and six (93.8%) reported that the price of GFD food was very expensive and 70 (61.9%) families that the diet was heavily affecting their family budget. Significant social difficulties were reported among the participating families and their children including interference with the child’s interaction with other children (49.6%), the families’ ability to attend social gatherings (60.2%), the families’ ability to eat in restaurants (73.5%), and the families’ ability to travel (58.4%). Conclusion: There is significant negative socio-economic impact of GFD on children with CD & their families. Health care providers should be aware of these psycho-social difficulties and be well trained to provide a proper education and psychological support for these patients and their families. Purpose: To determine the socio-economic impact of gluten free diet (GFD) on Saudi children and their families Methods: A cross-sectional study was conducted in which an online questionnaire was sent to all families registered in the Saudi celiac patients support group. We included only children (age 18 years of age and younger) with biop-sy-confirmed celiac disease (CD).Results: A total of 113 children were included in the final analysis, the median age was 9.9 years; 62.8% were females. One hundred (88.5%) of the participating families reported that GFD food was not easily available in their areas, 17% of them reported that it was not available at all in their area. One hundred and six (93.8%) reported that the price of GFD food was very expensive and 70 (61.9%) families that the diet was heavily affecting their family budget. Significant social difficulties were reported among the participating families and their children including interference with the child’s interaction with other children (49.6%), the families’ ability to attend social gatherings (60.2%), the families’ ability to eat in restaurants (73.5%), and the families’ ability to travel (58.4%). Conclusion: There is significant negative socio-economic impact of GFD on children with CD & their families. Health care providers should be aware of these psycho-social difficulties and be well trained to provide a proper education and psychological support for these patients and their families.",Ahmed Sarkhy(King Saud University); Mohammad I. El Mouzan(King Saud University); Elshazaly Saeed(King Saud University); Aziz Alanazi(King Abdulaziz Medical City); Sharifa Alghamdi(King Faisal Specialist Hospital); Shirin Anil(King Saud University); Asaad Assiri(King Saud University),소아과학,2016-09,영어
"Factors Associated with Removal of Impactted Fishbone in Children, Suspected Ingestion | Factors Associated with Removal of Impactted Fishbone in Children, Suspected Ingestion","Purpose: The management and clinical course in pediatric patients who had ingested foreign body were investigated retrospectively to evaluate the frequency and factor associated with successful removal of fishbone foreign body.Methods: Based on the medical records of patients younger than 15 years old who visited emergency room because of foreign body ingestion from January 1999 to December 2012, the authors reviewed clinical characteristics including type of ingested foreign bodies, time to visits, managements and complications.Results: Fishbone (50.1%) was the most common ingested foreign body in children. Among 416 patients with in-gested fishbone, 245 (58.9%) were identified and removed using laryngoscope, rigid or flexible endoscope from pharynx or upper esophagus by otolaryngologists and pediatric gastroenterologists. The kind of ingested fish bone in children was diverse. The mean age of identified and removed fishbone group was 7.39 years old, and higher than that of unidentified fishbone group (5.81 years old, p＜0.001). Identified and removed fishbone group had shorter time until hospital visit than the unidentified fishbone group (2.03 vs. 6.47 hours, p＜0.001). No complication due to ingested fishbone or procedure occurred.Conclusion: Older age and shorter time from accident to hospital visit were the different factors between success and failure on removal of ingested fish bone in children. Purpose: The management and clinical course in pediatric patients who had ingested foreign body were investigated retrospectively to evaluate the frequency and factor associated with successful removal of fishbone foreign body.Methods: Based on the medical records of patients younger than 15 years old who visited emergency room because of foreign body ingestion from January 1999 to December 2012, the authors reviewed clinical characteristics including type of ingested foreign bodies, time to visits, managements and complications.Results: Fishbone (50.1%) was the most common ingested foreign body in children. Among 416 patients with in-gested fishbone, 245 (58.9%) were identified and removed using laryngoscope, rigid or flexible endoscope from pharynx or upper esophagus by otolaryngologists and pediatric gastroenterologists. The kind of ingested fish bone in children was diverse. The mean age of identified and removed fishbone group was 7.39 years old, and higher than that of unidentified fishbone group (5.81 years old, p＜0.001). Identified and removed fishbone group had shorter time until hospital visit than the unidentified fishbone group (2.03 vs. 6.47 hours, p＜0.001). No complication due to ingested fishbone or procedure occurred.Conclusion: Older age and shorter time from accident to hospital visit were the different factors between success and failure on removal of ingested fish bone in children.",Chun Woo Lim(Gyeongsang National University Hospital); Min Hwan Park(Gyeongsang National University Hospital); Hyun Jeong Do(Gyeongsang National University Hospital); Jung-Sook Yeom(Gyeongsang National University Hospital); 박지숙(경상대학교); Eun Sil Park(Gyeongsang National University Hospital); 서지현(경상대학교); 박정제(경상대학교); Jae Young Lim(Gyeongsang National University Hospital); 박찬후(경상대학교); 우향옥(경상대학교); 윤희상(경상대학교),소아과학,2016-09,영어
Henoch-Schonlein Purpura in Children Hospitalized at a Tertiary Hospital during 2004-2015 in Korea: Epidemiology and Clinical Management | Henoch-Schonlein Purpura in Children Hospitalized at a Tertiary Hospital during 2004-2015 in Korea: Epidemiology and Clinical Management,"Purpose: To investigate the epidemiology, clinical manifestations, investigations and management, and prognosis of patients with Henoch-Schonlein purpura (HSP).Methods: We performed a retrospective review of 212 HSP patients under the age of 18 years who were admitted to Inje University Sanggye Paik Hospital between 2004 and 2015.Results: The mean age of the HSP patients was 6.93 years, and the ratio of boys to girls was 1.23:1. HSP occurred most frequently in the winter (33.0%) and least frequently in the summer (11.3%). Palpable purpura spots were found in 208 patients (98.1%), and gastrointestinal (GI) and joint symptoms were observed in 159 (75.0%) and 148 (69.8%) patients, respectively. There were 57 patients (26.9%) with renal involvement and 10 patients (4.7%) with nephrotic syndrome. The incidence of renal involvement and nephrotic syndrome was significantly higher in patients with se-vere GI symptoms and in those over 7 years old. The majority of patients (88.7%) were treated with steroids. There was no significant difference in the incidence of renal involvement or nephrotic syndrome among patients receiving different doses of steroids. Conclusion: In this study, the epidemiologic features of HSP in children were similar to those described in previous studies, but GI and joint symptoms manifested more frequently. It is essential to carefully monitor renal involvement and progression to chronic renal disease in patients ≥7 years old and in patients affected by severe GI symptoms. It can be assumed that there is no direct association between early doses of steroids and prognosis. Purpose: To investigate the epidemiology, clinical manifestations, investigations and management, and prognosis of patients with Henoch-Schonlein purpura (HSP).Methods: We performed a retrospective review of 212 HSP patients under the age of 18 years who were admitted to Inje University Sanggye Paik Hospital between 2004 and 2015.Results: The mean age of the HSP patients was 6.93 years, and the ratio of boys to girls was 1.23:1. HSP occurred most frequently in the winter (33.0%) and least frequently in the summer (11.3%). Palpable purpura spots were found in 208 patients (98.1%), and gastrointestinal (GI) and joint symptoms were observed in 159 (75.0%) and 148 (69.8%) patients, respectively. There were 57 patients (26.9%) with renal involvement and 10 patients (4.7%) with nephrotic syndrome. The incidence of renal involvement and nephrotic syndrome was significantly higher in patients with se-vere GI symptoms and in those over 7 years old. The majority of patients (88.7%) were treated with steroids. There was no significant difference in the incidence of renal involvement or nephrotic syndrome among patients receiving different doses of steroids. Conclusion: In this study, the epidemiologic features of HSP in children were similar to those described in previous studies, but GI and joint symptoms manifested more frequently. It is essential to carefully monitor renal involvement and progression to chronic renal disease in patients ≥7 years old and in patients affected by severe GI symptoms. It can be assumed that there is no direct association between early doses of steroids and prognosis.",Yong Hee Lee(Sanggye Paik Hospital); Yu Bin Kim(Sanggye Paik Hospital); Ja Wook Koo(Sanggye Paik Hospital); Ju-Young Chung(Sanggye Paik Hospital),소아과학,2016-09,영어
Correlation between Colon Transit Time Test Value and Initial Maintenance Dose of Laxative in Children with Chronic Functional Constipation | Correlation between Colon Transit Time Test Value and Initial Maintenance Dose of Laxative in Children with Chronic Functional Constipation,"Purpose: To evaluate the correlation between colon transit time (CTT) test value and initial maintenance dose of polyethylene glycol (PEG) 4000 or lactulose.Methods: Of 415 children with chronic functional constipation, 190 were enrolled based on exclusion criteria using the CTT test, defecation diary, and clinical chart. The CTT test was performed with prior disimpaction. The laxative dose for maintenance was determined on the basis of the defecation diary and clinical chart. The Shapiro-Wilk test and Pearson’s and Spearman’s correlations were used for statistical analysis. Results: The overall group median value and interquartile range of the CTT test was 43.8 (31.8) hours. The average PEG 4000 dose for maintenance in the overall group was 0.68±0.18 g/kg/d; according to age, the dose was 0.73±0.16g/kg/d (＜8 years), 0.53±0.12 g/kg/d (8 to ＜12 years), and 0.36±0.05 g/kg/d (12 to 15 years). The dose of lactulose was 1.99±0.43 mL/kg/d (＜8 years) or 1.26±0.25 mL/kg/d (8 to ＜12 years). There was no significant correlation between CTT test value and initial dose of laxative, irrespective of the subgroup (encopresis, abnormal CTT test subtype) for either laxative. Even in the largest group (overall, n=109, younger than 8 years and on PEG 4000), the correlation was weak (Pearson’s correlation coefficient [R]=0.268, p=0.005). Within the abnormal transit group, sub-group (n=73, younger than 8 years and on PEG 4000) correlation was weak (R=0.267, p=0.022). Conclusion: CTT test value cannot predict the initial maintenance dose of PEG 4000 or lactulose with linear correlation. Purpose: To evaluate the correlation between colon transit time (CTT) test value and initial maintenance dose of polyethylene glycol (PEG) 4000 or lactulose.Methods: Of 415 children with chronic functional constipation, 190 were enrolled based on exclusion criteria using the CTT test, defecation diary, and clinical chart. The CTT test was performed with prior disimpaction. The laxative dose for maintenance was determined on the basis of the defecation diary and clinical chart. The Shapiro-Wilk test and Pearson’s and Spearman’s correlations were used for statistical analysis. Results: The overall group median value and interquartile range of the CTT test was 43.8 (31.8) hours. The average PEG 4000 dose for maintenance in the overall group was 0.68±0.18 g/kg/d; according to age, the dose was 0.73±0.16g/kg/d (＜8 years), 0.53±0.12 g/kg/d (8 to ＜12 years), and 0.36±0.05 g/kg/d (12 to 15 years). The dose of lactulose was 1.99±0.43 mL/kg/d (＜8 years) or 1.26±0.25 mL/kg/d (8 to ＜12 years). There was no significant correlation between CTT test value and initial dose of laxative, irrespective of the subgroup (encopresis, abnormal CTT test subtype) for either laxative. Even in the largest group (overall, n=109, younger than 8 years and on PEG 4000), the correlation was weak (Pearson’s correlation coefficient [R]=0.268, p=0.005). Within the abnormal transit group, sub-group (n=73, younger than 8 years and on PEG 4000) correlation was weak (R=0.267, p=0.022). Conclusion: CTT test value cannot predict the initial maintenance dose of PEG 4000 or lactulose with linear correlation.",Mock Ryeon Kim(Konkuk University); 박혜원(건국대학교); 손재성(건국대학교); 이란(건국대학교); 배선환(Konkuk University),소아과학,2016-09,영어
Spontaneous Perforation of Colon in Previously Healthy Infantsand Children: Its Clinical Implication | Spontaneous Perforation of Colon in Previously Healthy Infantsand Children: Its Clinical Implication,"Purpose: Spontaneous colon perforations are usually encountered as necrotizing enterocolitis in the neonatal period, but occur rarely in infants and children without pathological conditions. This study was conducted to describe its clinical implication beyond the neonatal period. Methods: Cases of spontaneous colon perforation confirmed after the operation were reviewed retrospectively and the clinicopathological characteristics were analyzed. Clinical data were compared according to the presence of pneumoperitoneum as initial findings. Results: Eleven patients were included in the study period and showed a history of hospitalization before transfer due to management for fever, respiratory or gastrointestinal problems. Six patients showed a sudden onset of abdomi-nal distention and only seven patients showed a pneumoperitoneum as initial radiologic findings, however there were no significant clinicopathological differences. Perforation was found evenly in all segments of the colon, most commonly at the sigmoid colon in four cases. There were no specific pathologic or serologic causes of perforation. Conclusion: When previously healthy infants and children manifest a sustained fever with a sudden onset of abdomi-nal distention during management for fever associated with respiratory or gastrointestinal problems, there is a great likelihood of colon perforation with no pathological condition. Prompt surgical management as timely decision-mak-ing is necessary in order to achieve a good progress. Purpose: Spontaneous colon perforations are usually encountered as necrotizing enterocolitis in the neonatal period, but occur rarely in infants and children without pathological conditions. This study was conducted to describe its clinical implication beyond the neonatal period. Methods: Cases of spontaneous colon perforation confirmed after the operation were reviewed retrospectively and the clinicopathological characteristics were analyzed. Clinical data were compared according to the presence of pneumoperitoneum as initial findings. Results: Eleven patients were included in the study period and showed a history of hospitalization before transfer due to management for fever, respiratory or gastrointestinal problems. Six patients showed a sudden onset of abdomi-nal distention and only seven patients showed a pneumoperitoneum as initial radiologic findings, however there were no significant clinicopathological differences. Perforation was found evenly in all segments of the colon, most commonly at the sigmoid colon in four cases. There were no specific pathologic or serologic causes of perforation. Conclusion: When previously healthy infants and children manifest a sustained fever with a sudden onset of abdomi-nal distention during management for fever associated with respiratory or gastrointestinal problems, there is a great likelihood of colon perforation with no pathological condition. Prompt surgical management as timely decision-mak-ing is necessary in order to achieve a good progress.",김수홍(부산대학교); 조용훈(부산대학교); 김해영(부산대학교),소아과학,2016-09,영어
